{
  "$schema": "https://json-schema.org/draft/2020-12/schema",
  "$id": "https://programstart.local/schemas/programbuild-state.schema.json",
  "title": "PROGRAMBUILD workflow state",
  "type": "object",
  "required": ["system", "active_stage", "stages", "variant"],
  "properties": {
    "system": { "const": "programbuild" },
    "variant": { "type": "string" },
    "active_stage": { "type": "string" },
    "stages": {
      "type": "object",
      "minProperties": 1,
      "additionalProperties": {
        "$ref": "#/$defs/workflowEntry"
      }
    }
  },
  "$defs": {
    "signoff": {
      "type": "object",
      "required": ["decision", "date", "notes"],
      "properties": {
        "decision": { "type": "string" },
        "date": { "type": "string" },
        "notes": { "type": "string" }
      },
      "additionalProperties": true
    },
    "workflowEntry": {
      "type": "object",
      "required": ["status", "signoff"],
      "properties": {
        "status": { "enum": ["planned", "in_progress", "completed", "blocked"] },
        "signoff": { "$ref": "#/$defs/signoff" },
        "signoff_history": {
          "type": "array",
          "items": { "$ref": "#/$defs/signoff" }
        }
      },
      "additionalProperties": true
    }
  },
  "additionalProperties": true
}
